,Section,No,Question,List URL,Contents URL,Answer1,Answer2,Answer3,Answer4,Answer5
8,Insurance,74194,"저랑 저희 형님 보험 질문이요.  이번에 저랑 저희 형님 보험 리모델링 좀 하려고 합니다.   1. 괜찮은 보험인지 궁금합니다. 2. 현재 보험 상해등급이 학생으로 되어있는데 변경해야 하는건가요?     + 공인중개사 상해급수가 1급이 아니라 2급인가요? 생각해봐도 사무직인데 ;; 2급으로 들어간다는 소리가 있어서요.   - 본인 -    보험 : 한화 무배당 한아름 플러스 종합보험 1106,    나이 : 89년 6월 14일생   성별 : 남자   보험료 :  48,420원   직업 : 부동산 공인중개사   단독실비는 따로 있습니다.                       - 형님 -    보험 : 한화 무배당 한아름 플러스 종합보험 1106   나이 : 86년 11월 27일생   성별 : 남자   보험료 :  70,450원   직업 : 대학원 연구직                      ",http://www.ppomppu.co.kr/zboard/zboard.php?id=consulting&page=2&category=1&divpage=11,http://www.ppomppu.co.kr/zboard/view.php?id=consulting&page=1&divpage=11&category=1&no=74194, 회원님 공인중개사는 2급으로 적용 됩니다. 아무래도 집을 소개해주면서 밖에 나가시는 부분 때문에 2급 적용하는듯 합니다. 변경해주셔야 하구요. 유지중인 보험 월 5만원 미만 보험료로 보장 내용도 좋습니다. 다만 가입하던 시기 고려했을때 암은 최대 3천이였고 혈관질환 특약이 없어서 구성되지 않았습니다. 암진단금과 뇌혈관 질환진단금과 허혈성 심장질환 진단금을 보완해주는 것이 좋고 회원님 연령 고려하면 동부 어린이 보험 추천드립니다. 형님 회원님과 비슷한 보험으로 역시 가입시기 고려했을때 잘 구성된 보험입니다. 형님도 회원님과 동일하게 암진단금과 혈관질환이 부족한 편이라서 보완이 필요합니다. 형님은 어린이 보험 가입이 안되기 때문에 농협이나 엠지로 비교해보시면 되겠습니다. 컨설턴트 선택 후 문의 주시면 보다 자세한 안내 받을수 있습니다. 손은하컨설턴트 010 8979 0814,잘 유지하시면 되는 보험입니다. 내용 나쁘지 않구요 다만 가입하신 보험에서 3대진단비 부분이 다소 약합니다. 이부분만 심플하게 보완해 주시면 됩니다. 보험료 추가로 납입 가능하신 여력이 어느정도 인지 확인해 주셔서 회원님은 동부 어린이보험으로 설계하시고 형님은 농협으로 설계하시면 됩니다. 그리고 공인중계사는 2급이 맞습니다 컨설턴트명 클릭 후 양식에 맞게 쪽지 보내 주시거나 핸드폰으로 연락 주셔서 구체적인 상담 및 설계 받아보시기 바랍니다. 정재환 컨설턴트 010 4202 8239 ,#NULL,#NULL,#NULL
9,Insurance,74193,86년생 남자 30만원내외로 견적부탁  실비+3대질병+수술비+운전자+종신 namumite@naver.com 보기쉽게 깔끔하게 견적 보내주세요. 각각3개회사비교부탁 병력x 건강함 내일가입합니다. 댓글 안보니 메일로 보내주세요.,http://www.ppomppu.co.kr/zboard/zboard.php?id=consulting&page=2&category=1&divpage=11,http://www.ppomppu.co.kr/zboard/view.php?id=consulting&page=1&divpage=11&category=1&no=74193,메일주소는 스팸메일에 시달리실 수 있으시니 삭제를 해주시기 바랍니다. 보험을 준비하실 때에는 회원님의 상황을 알아야 그에 맞는 보험사와 상품을 선택하여서 설계를 드릴 수 있습니다. 때문에 정확한 생년월일 병력사항 직업 가족력 등을 확인해야 하며 보험료만 높다고 좋은 보장을 받는 것은 아닙니다. 종신보험만 준비를 하시더라도 30만원이 나오실 수 있습니다. 어느보장을 어떻게 받고 싶으신지 결혼 자녀 유 무 등에 따라서도 구성방식이 달라지게 됩니다. 첫 보험이신 것 같으신데 설계안만 받아보시면 향후 큰 손실을 보시고 해지를 하실 수 밖에 없으시니 쪽지 유선 문자로 상담신청을 하셔서 상담을 받고 회원님의 상황에 맞는 보험을 준비하시기 바랍니다. 맹창호 컨설턴트 &nbsp010 8286 5800,실비보험사의 보장건이 동일하므로 보험청구절차가 간소하고 지급이 빠른 상품을 선택하시면 되겠습니다. 진단금보장은 보험사마다 보장조건이 모두 상이합니다. 그래서 보험사를 선택하실때는 꼭 다음 조건을 확인해 보시기 바랍니다. 암보장의 경우 대장점막내암과 전립선암 방광암이 일반암에 포함되며 유사암 진단금이 높게 설정되는 보험사 뇌혈관질환은 꼭 뇌경색증이 포함되며 모든 뇌혈관질환을 커버하는 보험사 심혈관질환은 급성심근경색증보다 보장범위가 넓은 허혈성심장질환인 협심증이 포함되는 보험사 저해지환급형으로 가입하시면 일반적인 보험에 비해 30%정도 저렴하게 가입이 가능합니다. 보험설계를 위해서는 최소한 정확한 생일과 직업까지는 확인이 필요합니다. 이부분은 보험료가 직결되기 때문입니다. 그리고 원하시는 보장금액이나 만기도 알아야 합니다. 지금 말씀해 주신 내용으로는 어떤 설계도 불가능하세요. 메일주소를 노출하시면 많은 스펨메일을 받으실수 있습니다. 컨설턴트를 선택해 쪽지 문자로 문의해 주시면 자세한 안내를 받아보실수 있습니다. 정재성 컨설턴트 010 9131 1865, 실비 전사 동일한 보장조건으로 준비 할수 있습니다. 약관이 동일하기 때문에 어떤 회사를 선택해도 괜찮으나 청구가 잦은 보험이니 가급적 보험금 청구시 지급이 빠른 회사를 선택하는 것이 중요합니다. 3대 진단금+ 수술비 3대 진단금은 보장 범위가 가장 중요합니다. 암진단금은 전립선암이나 방광암 대장점막내암을 소액암이 아닌 일반암으로 100% 보장 받을수 있어야 하고 갑상선암을 보장하는 유사암 진단금은 암진단금에 20% 이상 구성되어야 합니다. 뇌질환은 뇌경색을 보장하는 뇌졸중진단금과 보다 넓은 보장 범위인 뇌혈관 진단금을 구성할수 있어야 합니다. 심장질환은 급성심근경색과 협심증을 보장하는 허혈성 심장질환 진단금을 구성해야 합니다. 수술비는 상해 질병 수술비가 가장 넓은 보장범위이며 그 외 30대나 34대 질병 수술비등을 추가로 구성하면 되겠습니다. 운전자 보험 운전자 보험 핵심은 변호사 선임비용 벌금 교통사고 처리지원금입니다. 세가지 특약만 구성시 20년납 80세 만기로 월 5천원 선이면 충분합니다. 종신보험 종신보험은 상속목적으로 많이 활용되는데요. 사망보장 1억정도 구성해도 월 보험료가 20만원 가까이 산출됩니다. 자녀 성장기에 조기사망 염려되어 준비 하는 거라면 종신보험 보단 정기보험으로 기간을 정해 저렴한 금액으로 보장받을수 있도록 준비 하면 되겠습니다. 설계를 위해선 회원님의 생년월일과 직업은 있어야 합니다. 그 외 희망하는 보험 만기나 가족력등이 반영 되면 회원님께 더 적합한 설계가 됩니다. 메일주소는 스팸메일 우려 있으니 지워주시구요. 컨설턴트 선택 후 문의 주셔서 자세한 안내 받으시기 바랍니다. 손은하컨설턴트 010 8979 0814,가입이 유의사항들은 저희 인증 컨설턴트들이 잘 안내해 주었네요. 간단히 요약하자면 실비와 암 뇌 심장질환에 대한 진단비 수술비 운전자보장만 심플하게 설계시 10만원이 안되는 금액으로 충분한 보장을 받을 수 있구요. 종신보험은 사망보험금을 남은 가족에게 상속할 목적으로 가입하는 것이 아니라면 3대진단비를 준비하는 보험에 질병 상해사망을 넣는 것으로 만족하거나 만기를 60 70세까지 지정해서 설계할 수 있는 정기보험으로 안내받아 보셔야 한다는 겁니다. 정확한 가입목적에 따라 선택되는 상품이 달라지고 보험료 편차도 커지며 설계를 위해선 정확한 생년월일과 하시는 업무 5년이내 고지해야될 병력사항이 있는지 확인이 필요합니다. 특별한 병력사항이 없는 상해 1급 86년생 남성분이시면 농협손보의 가성비굿 건강보험 또는 MG손보의 4대질병 진단보험 중 하나의 상품을 선택하여 설계하는데요. 가입된 보험이 없다는 전제하게 설계한다면 뇌혈관 허혈성진단비의 가입한도가 높고 배상책임과 가성비 좋은 몇가지 특약들을 함께 구성해서 설계할 수 있는 농협손보 의 가성비굿 건강보험이 적합합니다. 여기에 실비는 동부화재로 1만원대 운전자보장은 한화손보로 5천원대 보험료가 추가되며 3대진단비와 기타보장을 넣고 설계하는 농협손보는 8만원내외 비용으로 충분한 보장을 받을 수 있습니다. 게시글에 이메일 주소를 기재하면 저희 인증 컨설턴트가 아닌 타인에게 스팸메일등 악용의 우려가 있으니 컨설턴트를 통해 아래 연락처 또는 쪽지양식에 맞추어 문의 주시고 자세한 견적 받아보시기 바랍니다. 강신우 컨설턴트 010 2962 8727,설계에 필요한 정보가 없기 때문에 먼저 메일을 보내드릴 수 없습니다. 컨설턴트명 클릭 후 양식에 맞게 쪽지 보내 주시거나 핸드폰으로 연락 주셔서 구체적인 상담 및 설계 받아보시기 바랍니다. 정재환 컨설턴트 010 4202 8239 
10,Insurance,74192,"보험 재설계받고싶습니다.                                                                                                                                                      현재 나이는 30세 내년 31살입니다. 가입되어있는 가입내역과 보장내용입니다.     어머니께서 10몇년동안 납부하시다가 제가 받아서 납부하고 있는데,     갑자기 관심을 가져 재설계를 받고싶습니다.     아낌없이주는보험은 납입이 끝나서 60세까지 보장받으면 되고,     유니버설은 환급율 61% / 탑클래스는 환급율 57%입니다.     유니버설은 9년만 납입만하면 보장받을 수 있을꺼 같고,     탑클래스에 특약으로 실손들어가있고 , 실손도 지금 보다 조건이 좋아 해지하기엔 그렇고..     문제는 갱신 3년납입인거 같은데 손대야하나요? ",http://www.ppomppu.co.kr/zboard/zboard.php?id=consulting&page=2&category=1&divpage=11,http://www.ppomppu.co.kr/zboard/view.php?id=consulting&page=1&divpage=11&category=1&no=74192,유니버셜종신보험은 특약들이 대부분 갱신형입니다 유지하시더라도 갱신형 특약들은 다 삭제하시고 유지하세요 탑클래스변액유니버셜CI보험은 다시는 가입하실수 없는 조건의 실손의료비입니다 이 또한 유지하셔야 하는데요 이대로 말구요 실손의료비제외하고 갱신형 특약삭제하시구요 주계약도 최소로 하시는 걸로 이렇게 유지를 하셔도 회원님을 위한 보장이 제대로 안되어 있으세요 생명보험사의 사망에 집중되어 있습니다 지금 필요한 보장은 회원님을 평생 지켜줄수 있는 암 뇌 심장질환에 대한 보장금액인 진단비이구요 이 진단비를 준비하실때는 생명보험사로는 안되시구요 손해보험사로하시면 되시는데요 현재 가장 추천하는 상품은 무해지환급형 어린이 보험 일명 어른이보험인데요 보장 조건이 가장 넓고 크게 하실수 있으면서 보험료까지 저렴해서 기존 보험을 보완하실때 정말 효율적이세요 생식기질환까지 다 일반암으로 보장하구요 갑상선암과 같은 유사암은 1천만원에서 최대 2천만원까지 보장이 되시구요 단일질병으로 가장 발병율이 높은 혈관질환중에 가장 보장범위가 넓은 뇌혈관과 허혈성심장질환을 2천만원씩 준비하실수 있으세요 그외 원하시는 특약들이 있으시면 함께 구성하실수 있습니다 각종 수술비 후유장해 배상책임등이 있으시구요 기준을 유지에 부담이 없으신 보험료로 잡고 그에 맞게 진단비의 크기와 보장기간을 선택하시면 되세요 보험사로는 동부 MG 메리츠가 경쟁력이 있으세요 컨설턴트에게 상담문의를 하셔서 회원님이 원하시는 보장에 대한 효율적인 추천설계안과 정확한 안내를 받아보시길 바랍니다 강치환 컨설턴트 010 8640 3646,07년 유니종신 주계약 감액 없이 그대로 재해 상해 5천만 원 상해 치료비 1천만 원 3가지는 유지하세요. 11년이 넘은 증권이고 주계약 원금은 소멸도 아닙니다. 갱신형 항목 재해 사망은 모두 삭제로 추천해 드립니다 오래된 증권이지만 보장 범위도 일반 수술비도 아닌 특정질병 수술비로 좋은 조건은 아닙니다. 12년 변액유니CI 이증권의 주계약은 최저 2천만 원까지 낮추시고 07년 증권에 추가 납입이 더 낫습니다. 물론 07년 상품은 일반 상품으로 보험료는 변액 상품보다 비싸지만 최저 보증 이율 등 조건 비교해서 선택하세요. 결국은 이 증권은 실손의료비 보장 때문에 유지로 보셔도 무방합니다. 비싸죠 그래도 유지가 맞습니다. 38 000 정도 감액 가능으로 보입니다. 60세까지 보장 내용 확인은 안 되지만 만기 짧기에 진단비 보장만 새롭게 준비하시는 방향입니다. 현재 89년생으로 예상이라 아직 보험 나이 30세로 어린이 상품으로 사망 보장 없이 필요한 보장만 선택 구성할 수 있는 좋은 조건입니다. 일반 암 5천만 뇌혈관 + 뇌졸중 허혈성 심장 질환 진단비 상해후유장해 3%부터 기존 5천만 원 보유로 5천만 원 보완하시면 좋겠습니다. 개별 상담 요청하시면 전반적인 설명 후 추천 설계안으로 안내받아보실 수 있습니다. 이종미 컨설턴트 011 494 6303 , 아낌없이 주는 보험 이미 납입완료가 된 상품으로 보장만 잘 받으시면 되는 상품입니다. 유니버셜종신골드 사망 재해보장을 원하신다면 유지를 하셔도 되는 상품이지만 그렇지 않다면 이보험은 해지를 권해드립니다. 주요질환인 암보장 입원 수술비 보장이 모두 갱신형이기 때문에 보험료는 3년마다 계속 하여 상승하며 80세까지 보험료를 납입을 하셔야 합니다. 사망보장 3천만원도 남성분께 크게 도움이 되는 보장금액은 아닙니다. TOP클래스변액 종신보험과 동일한 보장을 하는 상품이지만 이보험은 지금보다 유리한 실비특약이 구성된 상품입니다. 주보험을 2 3천만원으로 감액을 하시고 실비특약이외 다른 특약을 모두 삭제 후 유지를 권해드립니다. 회원님의 나이에 많은 보험료를 납입하고 계시지만 그에 알맞는 보장을 받고 계시지 못한 상황이십니다. 리모델링 해지를 통해서 보험료를 줄이시고 주요질환인 암 뇌 심장질환 진단금과 성인질환 수술비 보장을 비갱신형으로 보완해 주시면 좀더 효율적인 보장이 가능하십니다. 회원님의 경우 30세 이하이시기 때문에 어린이 보험으로 성인보험보다 유리한 보장구성이 가능하세요 컨설턴트를 선택하여서 쪽지나 유선연락을 주시면 빠른 상담 받아보실 수 있습니다. 맹창호 컨설턴트 &nbsp010 8286 5800,안녕하세요 아낌없이 주는 보험은 납입이 끝나셨으니 잘 유지하시면 됩니다. 이 보험에서 현재 암진단비 1천5백만원과 암수술비 450만원을 보장받으실 수 있네요 40세이후에는 암진단비 2천 암수술비 600만원 문제는 유니버설종신골드와 탑클래스종신보험인데요 유니버설종신골드는 대부분의 특약이 갱신형입니다. 주보험은 비갱신이라 말씀하신 것처럼 9년 만 더 납입하면 끝나지만 갱신형은 그 이후에도 계 속 보험료를 납입하셔야 하지요 갱신형이니 보험료도 오를테구요 사망보장 특히 노후 사망 시 상속까지 고려하시는게 아니면 이 보험은 더 늦기 전에 해지하시고 진단비 등 필요보장을 비갱신형으로 다시 준비해두시는 것이 장기적으로 유리하겠습니다 탑클래스종신보험 역시 대부분이 갱신형 하지만 이 보험에는 알고 계신대로 지금보다 조건이 좋은 실비특약이 추가되어 있으니 실비는 살리는 방향으로 리모델링 하시는 것이 좋겠네요 실비 이외의 갱신형은 가능한한 삭제하시고 사망보장 원치 않으시면 주보험도 최소로 낮춰보시면 됩니다 이와 동시에 회원님께 필요할만한 보장들을 비갱신형으로 보완하셔야 할텐데요 암 뇌 심장 질환 진단비 등 병원비를 위한 보장은 손해보험사가 유리하며 아직 보험연령으로 30세를 초과하지 않으셨다면 어린이보험 중에서 선택하시면 더욱 좋은 조건으로 가입하실 수 있습니다 DB손보 한 건으로 설계하는 것도 좋지만 MG와 DB를 조합하는 형태로 진행하시면 보험료는 더 낮추고 보장은 더 좋게 준비하실 수 있죠 단 위의 리모델링 방법은 현재 건강상황이나 과거 치료력에 별다른 문제가 없다는 것을 가정한 것이니 우선은 새로 가입할 설계를 알아보신 뒤 심사까지 마치신 다음 기존 보험을 정리하는 것이 안전한 점 참고 부탁드려요 아래의 컨설턴트 명 클릭 후 상담요청 주시거나 연락처로 전화주시어 회원님께 가장 유리한 리모델링에 대한 객관적인 컨설팅을 받아보시기 바랍니다 좋은 하루 되세요 최상길 컨설턴트 010 7379 1774 ,#NULL
11,Insurance,74191,보험사끼리 심사내역 공유하나요?  보험가입심사를 넣으면 승인심사거절당한 내역을 보험사끼리 공유할까요? 어떤 이유로 거절되었는에대한 내역이여 * insurance 에서 게시물 이동되었습니다 (2018-11-12 23:10 / no : 72045),http://www.ppomppu.co.kr/zboard/zboard.php?id=consulting&page=2&category=1&divpage=11,http://www.ppomppu.co.kr/zboard/view.php?id=consulting&page=1&divpage=11&category=1&no=74191,보험사기리 공유할수 없습니다. 단 해당 보험사엔 기록이 남게 됨으로 주의하셔야 합니다. 컨설턴트 선택 후 문의 주시면 보다 자세한 안내 받을수 있습니다. 손은하컨설턴트 010 8979 0814,보험심사내역은 보험사끼리 공유되지 않습니다. 컨설턴트를 선택하여서 쪽지나 유선연락을 주시면 빠른 상담 받아보실 수 있습니다. 맹창호 컨설턴트 &nbsp010 8286 5800,심사 내용은 공유할 수 없습니다. 당시 기록은 남고요. 좀 더 상세한 안내 필요하시면 상담 요청하시면 되겠습니다. 이종미 컨설턴트 011 494 6303 ,심사기록은 심사를 받은 보험사에만 남아있고 다른 보험사에 공유되지 않습니다. 모든 보험사에 공유되는 부분은 보험금을 청구하신 기록입니다. 강신우 컨설턴트 010 2962 8727,심사내용은 공유되지 않습니다. 다만 기존보험에서 보험금청구한 이력이 있을 경우 보험개발원에 기록이 남아 있으며 이를 보험사가 알 수 있습니다. 컨설턴트명 클릭 후 양식에 맞게 쪽지 보내 주시거나 핸드폰으로 연락 주셔서 구체적인 상담 및 설계 받아보시기 바랍니다. 정재환 컨설턴트 010 4202 8239 
12,Insurance,74190,암보험 질문요  제가 메리츠에 암이랑 롯데보험에 천만원 암보험이있는데 일본생활오래하고 술담배많이해서 암보험을 하나더 가입하고 싶은데(3000만~5000만)어떻게 가입하는게 좋을까요?추천하는회사가있을까요?괜찮으면 가입설계서 받아보고싶어요 연락주세요 * insurance 에서 게시물 이동되었습니다 (2018-11-12 23:06 / no : 72046),http://www.ppomppu.co.kr/zboard/zboard.php?id=consulting&page=2&category=1&divpage=11,http://www.ppomppu.co.kr/zboard/view.php?id=consulting&page=1&divpage=11&category=1&no=74190,제가 메리츠에 암이랑 롯데보험에 천만원 암보험이있는데 일본생활오래하고 술담배많이해서 암보험을 하나더 가입하고 싶은데 3000만 5000만 어떻게 가입하는게 좋을까요 추천하는회사가있을까요 괜찮으면 가입설계서 받아보고싶어요 연락주세요,딱 암보험만 필요하신건가요 그렇다면 일반암진단비위주로 선택하시면 되세요 상품적으로는 무해지환급형 상품으로 준비하시면 되시구요 보험사로는 MG 흥국 농협정도가 경쟁력이 있으세요 가장 근본적인 보장이 일반암진단비입니다 갑상선암과 같은 유사암을 제외하고는 모든 암을 다 보장하는데요 일반암의 크기와 언제까지 보장을 받게 설계하실꺼냐에 따라서 보험료가 달라지니까요 회원님이 유지에 부담이 없으신 보험료를 기준으로 해서 추천설계안을 받아보시면 좋겠습니다 컨설턴트에게 상담문의를 하셔서 회원님이 원하시는 보장에 대한 효율적인 추천설계안과 정확한 안내를 받아보시길 바랍니다 강치환 컨설턴트 010 8640 3646,순수하게 암에 대한 보장만 준비를 하신다면 MG손해보험이나 흥국화재 보험이 유리하십니다. 만약 뇌 심장질환 보장까지 구성을 하신다면 농협손해보험과도 비교를 해보시기 바랍니다. 컨설턴트를 선택하여서 쪽지나 유선연락을 주시면 빠른 상담 받아보실 수 있습니다. 맹창호 컨설턴트 &nbsp010 8286 5800,회원님 나이 직업이 어떻게 되는지요 올려주신 내용 외에 다른 항목도 함께 점검은 받아보셨으면 합니다. 일반 암 보장만 5천만 원 준비하신다면 흥국으로 먼저 추천해 드립니다. 개별 상담을 통해 회원님께 맞는 구성으로 제안서 받아보세요. 이종미 컨설턴트 011 494 6303 ,술담배 많이 하시면 암도 발병율이 높지만 2대질병인 혈관질환도 발병율이 엄청 높아집니다. 암은 현재 4천만원이 준비가 되어 있습니다. 추가로 1 2천 정도만 더 가입하시고 2대질병 진단비를 든든하게 가입하시는 것이 좋습니다. 실비보험은 있으신가요 진단비에 선행하는 더욱 중요한 보장이 실비보험입니다. 컨설턴트명 클릭 후 양식에 맞게 쪽지 보내 주시거나 핸드폰으로 연락 주셔서 구체적인 상담 및 설계 받아보시기 바랍니다. 정재환 컨설턴트 010 4202 8239 
