,Section,No,Question,List URL,Contents URL,Answer1,Answer2,Answer3,Answer4,Answer5
0,Insurance,74203,"누수보험  안녕하세요, 40년넘은 서울의 아파트에 거주 예정입니다. 오래된 아파트라 누수보험을 꼭 할텐데요, 화재보험 문의 드립니다. 100제곱미터 26평형 입니다.  감사해요~  가격은 2만원 이내, 보장 내역이 보험사 마다 다른데.. 궁금합니다~",http://www.ppomppu.co.kr/zboard/zboard.php?id=consulting&page=2&category=1&divpage=11,http://www.ppomppu.co.kr/zboard/view.php?id=consulting&page=1&divpage=11&category=1&no=74203,누수보장이 주 목적이시라면 배상책임 특약이외에 누수보장이 있는 상품을 선택 하셔야 합니다. 일반적인 배상책임 특약은 상대방 보장만되고 회원님의 집은 보장 받을 수 없는 상황도 있으시니 상품선택이 중요하시며 2만원정도면 든든한 보장구성이 가능하십니다. 컨설턴트를 선택하여서 쪽지나 유선연락을 주시면 빠른 상담 받아보실 수 있습니다. 맹창호 컨설턴트 010 8286 5800,#NULL,#NULL,#NULL,#NULL
1,Insurance,74202,"부모님이 가입해두신 보험인데 조언 좀 부탁드립니다.  안녕하세요.   예전에 부모님께서 가입해두신 보험을 제가 부담하게 되어서 보장내용이 궁금해 지더라구요   어머님말씀으론 이거하나면 된다고 하시는데 제가보기엔 보험료가 과한듯하네요   변액종신이라.. 현재는 해지하고 어린이보험으로 재설계 할 생각입니다.   나름 이것저것 찾아봤는데 아무래도 지식이 많이 부족하여 확신이 안서서 조언 부탁드립니다.  남자 만30세 입니다.   교보생명 더든든한(무)교보변액유니버셜통합종신보험(2종,가산형,표준체)     질병사망-주계약 100,000,000 상해사망-주계약 100,000,000 상해후유장해-재해상해특약(1형) 50,000,000 뇌출혈진단-남성건강치료특약 10,000,000 급성심근경색진단-남성건강치료특약 10,000,000 암진단-교보암진단특약(갱신형) 50,000,000 골절진단-재해치료비특약(1형) 200,000 질병종수술-교보수술특약(갱신형) 3,000,000 특정질병수술-남성건강치료특약 5,000,000 상해수술-재해치료비특약(1형) 300,000 상해종수술-교보수술특약(갱신형) 3,000,000 기타수술-남성건강치료특약 5,000,000 특정질병입원일당-남성건강치료특약 50,000   월보험료 :157,539   가정이 있는것도아니라 종신은 필요없을것 같고   제 생각엔 보장에 비해서 보험료가 너무 많은것 같아요   해지하고 어린이보험으로 재설계 하는게 맞는 판단일까요?    * insurance 에서 게시물 이동되었습니다 (2018-11-13 11:05 / no : 72053)",http://www.ppomppu.co.kr/zboard/zboard.php?id=consulting&page=2&category=1&divpage=11,http://www.ppomppu.co.kr/zboard/view.php?id=consulting&page=1&divpage=11&category=1&no=74202,살아있는 동안 아프거나 다쳤을때의 보장이 목적이라면 유지보단 해지하는 쪽으로 방향을 잡으셔야 합니다. 종신보험은 모든 사망을 종신토록 보장하는 주계약에 대한 보험료 비중이 높구요. 특약으로 구성된 암진단비도 갱신형이라 추후 보험료 부담이 커질 수 밖에 없고 뇌질환의 대부분을 차지하는 뇌경색을 보상하지않고 뇌출혈만 보장하기때문에 보장범위도 협소합니다. 생년월일이 어떻게 되시나요 88년 5월중순이후 출생이시면 보험연령 30세 적용으로 성인보험보다 유리한 조건으로 설계되는 어린이보험을 통해 비용을 대폭 낮추고 보장은 더 좋은 조건으로 3대진단비를 준비할 수 있구요. 무해지환급 조건으로 설계되는 어린이보험은 동부 메리츠 MG손보가 있는데 남성분이시면 메리츠보다 더 저렴한 보험료가 적용되는 동부화재로 안내받아보셔야 합니다. 암진단비는 동부보다 MG손보에서 더 저렴한 보험료를 적용받고 갑상선암 보장한도를 2천만원까지 업계최고 보장을 받을 수 있기때문에 MG와 동부를 조합하면 가장 이상적인 보장을 받을 수 있습니다. MG를 비선호 하신다면 보험료는 다소 높아지더라도 동부화재 단건으로 3대진단비와 배상책임 그외 가성비 좋은 특약까지 함께 넣고 설계해주셔야 하는데요. 5년이내 고지해야될 병력사항과 가입목적 납입수준등에 따라 추천해드릴 수 있는 보험사는 달라질 수 있습니다. 컨설턴트 선택 후 아래 연락처 또는 쪽지양식에 맞추어 문의주시고 자세한 안내 받아보세요. 강신우 컨설턴트 010 2962 8727,이보험으로는 많이 부족합니다. 그리고 앞으로도 사망보장보험에 대한 니즈가 없으시면 손해는 크지만 해지하시는게 좋겠습니다. 그리고 이보험이외 다른 보험이 없으시면 일단은 실비보험을 먼저 가입하셔야 합니다. 실비보험은 모든 보험사의 보장조건이 동일하므로 보험금 청구절차가 간소하고 지급이 빠른 보험사를 선택하시는게 중요합니다. http www.ppomppu.co.kr zboard view.php id consulting&page 1&divpage 13&no 69546 현재 가입이 가능한 실비보험의 보장조건과 보험사별 보험료 비교자료 입니다. 주요3대질환 진단금은 보험사마다 보장조건이 모두 상이합니다. 그래서 보험사 선택이 매우 중요합니다. 우선 회원님의 나이와 직업 병력 가족력에 적합한 상품을 선택해야 합니다. 다음으로 특약별 보장조건도 꼼꼼하게 비교해 보셔야 합니다. 암보장의 경우 대장점막내암 전립선암 방광암까지 일반암으로 보장하며 유사암 진단금이 높게 설정되는 보험사 뇌혈관질환은 꼭 뇌경색증이 포함되며 뇌혈관질환 전체를 커버하는 특약이 포함되는 보험사 급성심근경색증 진단금보다 보장범위가 넓은 허혈성심장질환인 협심증이 포함되는 보험사 저해지환급형으로 가입하시면 일반적인 보험에 비해 30%정도 저렴하게 가입이 가능합니다. 결론적으로 보험사에 고지하실 병력만 없으시면 해지 후 보장목적에 맞는 상품을 선택해 다시 준비하시기 바랍니다. 컨설턴트를 선택해 쪽지 문자로 주시면 자세한 안내를 받아보실수 있습니다. 정재성 컨설턴트 010 9131 1865,가입된 보장은 말 그대로 사망보장이 주된 목적이며 그외 구성된 특약은 다수가 갱신형으로 구성되어 있습니다. 병원비 보장의 실손은 별도로 가입되어 있으신가요 갱신형 특약은 추후 갱신시점 보험료 인상은 물론이며 보장받는 기간 내내 평생 보험료를 납부하셔야 합니다. 또한 생명보험사의 뇌출혈 보장은 뇌졸중과 뇌경색증은 보장이 되 지 않기 때문에 보장범위가 넓은 보험사를 통해 주요 진단비는 재구 성이 필요합니다. 사망보장의 니즈가 없으시다면 살아있는 동안의 생존보장으로 준비 하시고 실손은 단일형 1만원대 그외 진단비는 비갱신형으로 보강해 주시면 됩니다. 회원님의 생년월일 직업 5년내 병력사항 가족력 등의 기본사항에 맞는 보장으로 안내 받아보세요 리모델링에 앞서 회원님의 병력사항 여부에 따라 조언 및 리모델링 방향은 달라질수 있습니다. 컨설턴트 선택후 쪽지나 유선으로 문의하시면 상세 도움 받아보실 수 있습니다. 이수미 컨설턴트 010 8743 7139 ,사망보장에 대한 니즈가 없다면 정리하시고 재구성하세요. 언급하셨듯이 어린이보험상품으로 보장범위 넓고 보장보험료 저렴하고 보장한도 높게 준비하실 수 있습니다. 핵심보장은 의료실비보장과 3대진단비 암 뇌 심장 비갱신입니다. 현의료실비보장은 1년갱신 15년마다 재계약을 통하여 100세까지 갱신이 가능하며 전보험사 통합되어 동일하게 보장하고 있습니다 질병 상해 입원시 5천만원한도 질병 상해 통원시 25만원 질병 상해 약제비 5만원 비급여 MRI MRA 300만원 비급여 도수 체외 350만원 비급여 주사 250만원한도 자기부담금을 제외하고 한도내에서 실손으로 보상받을 수 있구요 3대진단비의 경우 보장보험료 의무설정 보장범위 납입면제 보장한도 등등 잘 따져보셔야 하는데요. 다음조건을 만족하는 상품이 좋습니다. 유사암 갑상선암 기타피부암 경계성종양 제자리암 을 제외한 모든암 생식기 유방 대장점막내암 전립선 포함 을 보장하는 상품으로 준비하셔야 하며 유사암은 암진단금의 20%이상보장하는 상품이 좋습니다 혈관질환의 경우 적어도 뇌경색을 포함한 뇌졸중 보다 넓은 범위인 뇌혈관 협심증을 포함하는 허혈성 특약 구성이 중요합니다 현재는 미해지환급형으로 순수보장형보다 20 30%저렴하게 가입이 가능하며 보장납입 기간설정은 20년납 80 90세만기가 적당하구요. 유지에 부담이 없는 보험료 가족력 병력사항 보장니즈에 맞춰 효율적인 구성 및 충분한 비교견적 도와드리겠습니다 상담신청 남겨주시면 자세한 안내 받아보실 수 있습니다. ,사망보장이 1억이 설정되어 있어서 대부분의 보험료가 사망보장으로 지출될듯합니다. 회원님이 사망 보장에 니즈가 없다면 이 보험은 정리 하는 것이 좋겠습니다. 주요 질병 특약은 갱신형으로 구성되어 있어 매 갱신주기 마다 인상되는 보험료를 보장기간 내내 납입해야 함으로 시간이 지날수록 보험료 부담이 커져 유지가 어려운 구조입니다. 또한 뇌경색은 보장하지 않는 뇌출혈 보장이고 협심증을 보장하는 허혈성 심장질환 진단금이 없어 보장의 빈틈이 있습니다. 이 보험은 정리 후 손해보험사 비갱신 어린이 보험으로 다시 준비 하면 되겠습니다. 3대 진단금은 보장 범위가 가장 중요합니다. 암진단금에서 전립선암이나 방광암 대장점막내암을 소액암이 아닌 일반암으로 100% 보장 받아야 하고 유사암은 암진단금에 20% 이상 보장 받아야 합니다. 혈관 질환 중 가장 보장범위가 넓은 뇌혈관 진단비와 허혈성 심장질환 진단금을 구성해야 빈틈없이 보장 받을수 있습니다. 꼭 비갱신으로 구성해서 향후 인상되는 보험료가 없도록 해야 하고 납입기간은 20년 만기는 80세나 90세면 충분합니다. 납입에 부담없는 보험료 선을 정한 후 그 안에서 회원님 병력과 가족력 니즈 반영하여 구성하기 바랍니다. 컨설턴트 선택 후 문의 주시면 보다 자세한 안내 받을수 있습니다. 손은하컨설턴트 010 8979 0814
2,Insurance,74201,"만27세 여 보험 도와주세요ㅠㅠ        만 27세 여 보험 입니다   종신변액보험과 연금보험을 가지고있는데 계속 안고가야하는건지   또한 추가로 들어야할 보험이 있는지 확인 부탁드려요ㅠㅠ       - 교보생명 무배당교보변액유니버셜종신보험(가족형)   변액+종신 보험은 정말 안좋다고 들어서 해지해야하는지 고민입니다ㅠㅠ   변액보험에대해서 봐도 잘모르겠어서 상담사와 통화결과 [특약제외, 주계약중 사망보험제외, 사업비제외] 후 금액이 변액보험에 투입 되어있고 지금까지 투자 된 총 금액이 2,870,000원 이라 들었습니다 수익률은 3.1%라고 들었습니다   하지만 설명을 들어도 너무 어렵네요ㅠㅠ   1) 변액보험을 잘모르지만 투입액이 적은거같은데 원래 변액보험이 이런건가요? 2) 유지, 해지, 재설계가 필요한 부분에 대해서 조언 부탁드립니다.                  - 삼성 여성행복연금무적립   3)연금보험으로 들어논건데 괜찮은건가요?                  * insurance 에서 게시물 이동되었습니다 (2018-11-13 11:04 / no : 72052)",http://www.ppomppu.co.kr/zboard/zboard.php?id=consulting&page=2&category=1&divpage=11,http://www.ppomppu.co.kr/zboard/view.php?id=consulting&page=1&divpage=11&category=1&no=74201,간단히 설명드리면 변액종신보험은 회원님께서 납입하신 보험료에서 위험보험료와 사업비를 차감하고 남는 그액을 주식과 채권에 투가해 발생한 수익을 드리는 보험입니다. 손해도 회원님께서 감수하셔야 하구요. 수익률은 매년 매달 달라질수 있습니다. 변액보험이 꼭 나쁜건 아니지만 보험자체가 회원님께 불필요한 종신보험이라는 점입니다. 하지만 이보험에 포함된 실비는 지금인 가입이 불가능한 조건입 니다. 그래서 해지는 좋지 않습니다. 손해는 발생하겠지만 다음과 같이 특약정리하신 후 유지하시기 바랍니다. 1. 주보험을 최소로 감액하시기 바랍니다. 2. 실손의료비이외 모든 특약은 삭제하시기 바랍니다. 이후 암 뇌혈관 심혈관질환 진단금만 심플하게 보완하시면 되겠습니다. 주요 3대질환 진단금보장은 보험사마다 보장조건이 모두 상이하므로 꼭 다음 조건을 충족하는 상품을 선택하시기 바랍니다. 대장점막내암 자궁암 난소난관암 유방암까지 일반암으로 보장하며 유사암 진단금이 높게 설정되는 보험사 뇌혈관질환은 꼭 뇌경색증이 포함되며 뇌혈관질환 전체를 커버하는 특약이 포함되는 보험사 급성심근경색증 진단금보다 보장범위가 넓은 허혈성심장질환인 협심증이 포함되는 보험사 저해지환급형으로 가입하시면 일반적인 보험에 비해 30%정도 저렴하게 가입이 가능합니다. 마지막으로 삼성생명 연금보험은 좋은 상품입니다. 잘 유지하시기 바랍니다. 컨설턴트를 선택해 쪽지 문자로 주시면 자세한 안내를 받아보실수 있습니다. 정재성 컨설턴트 010 9131 1865,변액종신보험에 실비특약이 포함되어 있어서 해지를 하시는 것 보단 실비만 남겨두시고 최대한 주계약은 감액 후에 나머지 특약은 삭제하시는 것이 좋습니다. 이 보험은 실비보험으로만 남겨두시기 바랍니다. 지금 가입가능한 실비에 비해서 내용이 더 좋습니다. 연금보험은 그대로 유지하시기 바랍니다. 노후대비를 위한 연금상품이며 특별히 문제되는 부분은 없습니다. 변액종신보험을 리모델링 하신 후에는 보장이 턱없이 부족하기 때문에 3대진단비 위주로 추가가입을 해주셔야 합니다. 손해보험사의 무해지환급형으로 추천드리고요 30세 미만이시라 어린이보험으로 준비해 주시면 됩니다. 정확한 설계를 하려면 가입하시는 분의 기본적인 정보가 있어야 가능합니다. 생년월일 직업 원하시는 보험료 및 병력 사항 등 확인해 주시고 상담신청 해주시기 바랍니다. 컨설턴트명 클릭 후 양식에 맞게 쪽지 보내 주시거나 핸드폰으로 연락 주셔서 구체적인 상담 및 설계 받아보시기 바랍니다. 정재환 컨설턴트 010 4202 8239 ,교보생명 종신보험은 여성분이시기 때문에 사망보장이 필요하지 않습니다. 하지만 실비는 지금보다 좋은 조건으로 가입이 되어 있기 때문에 해약을 하시는 것 보다는 주계약을 최소로 하고 실비 정도만 남겨두시면 되겠습니다. 삼성생명 연금보험은 부담이 되지 않으신다면 유지를 하시되 추가로 여력이 되신다면 추가납입을 활용하시는게 좋으세요. 그리고 추가로 3대진단비 정도만 보완을 하시면 되는데요. 손해보험사에 비갱신형으로 추천을 드립니다. 암진단은 대정점막내암이 일반암으로 보장이 되면서 소액암이 최대로 보장이 되며 2대진단은 뇌혈관 허혈성 담보가 추가가 되는 보험사로 가입을 하시는게 좀더 유리하겠습니다. 20대이시기 때문에 동부나 메리츠 어린이보험 미해지환급형으로 추천을 드립니다. 자세한 내용은 컨설턴트를 선택하셔서 쪽지나 카톡 등 으로 개별 상담을 받아보시기 바랍니다. 전은화 컨설턴트 010 6277 1844 , 교보 변액종신보험 해당 보험은 투자 상품이라기 보단 건강보험이라고 생각하면 되겠습니다. 다만 보장성 보험료 외 보험료를 투자에 활용하게 되는데요. 투자로써의 가치는 없기 때문에 보험으로써의 가치를 따지면 되겠습니다. 우선 사망보장이 주목적인 종신보험이다 보니 대부분의 보험료가 사망보장에 지출되고 있어 여성에게 적합한 보험은 아닙니다. 주요 질병 특약은 갱신으로 구성되 었는데 갱신형 특약은 3년 단위로 인상되는 보험료를 보장 기간 내내 납입해야 함으로 시간이 지날수록 보험료 부담이 커지는 구조 입니다. 다만 실비 보장은 현재 보다 좋기 때문에 이 보험은 실비 보험위주로 리모델링 후 유지해야 합니다. 주계약 최소 2천으로 낮추고 실비 특약 제외한 나머지 특약은 삭제 하기 바랍니다. 그런 후 손보사 비갱신으로 암 뇌질환 심장질환 위주로 보완하면 되겠습니다. 연금 유지한지 오래된 연금 보험이니 잘 유지하기 바랍니다. 안정성을 생각하면 채권에 수익을 생각하면 주식에 운영하면 되겠습니다. 컨설턴트 선택 후 문의 주시면 보다 자세한 안내 받을수 있습니다. 손은하컨설턴트 010 8979 0814,1. 보험료 전액이 투자목적으로 운용된다면 3.1% 라는 수익률이 너무나 매력적이겠으나 종신보험은 기본적으로 사망보장이 주가 되는 상품이라 위험보험료와 사업비 차감이 엄청납니다. 3.1%는 온갖 명목으로 보험료가 빠져나가고 적용되는 내용이라 큰 의미가 없구요 사망보장에 큰 흥미를 못 느끼신다면 서둘러 해약하시는게 나으실 겁니다. 2. 연금보험 완납까지 얼마 안남은 상품이라 잘 유지하시면 되세요 3. 부족한 보험 만약 종신보험에 모든 리스크 관리를 의존하고 계셨다면 단독실비와 3대진단비 정도는 새롭게 보완하셔야 합니다. 종신보험이 사망에 대해 보장하는 내용이라면 실비와 3대진단비는 살아가며 겪을 수 있는 상해 질병 나아가 중병에 대한 대비까지 모두 되는 상품이기 문입니다. 쪽지나 유선문의 남겨주시면 자세한 설명 받아보실 수 있습니다. 오규원 컨설턴트 010 4691 2828
3,Insurance,74200,태아 보험 견적요청드립니다 현재 11주차 접어들었습니다. 엄마 아빠 둘다 84년 생입니다.    태아보험 견적 요청 드립니다.    shinycross@gmail.com * insurance 에서 게시물 이동되었습니다 (2018-11-13 09:57 / no : 72050)태아 보험 견적요청드립니다 1 2 ,http://www.ppomppu.co.kr/zboard/zboard.php?id=consulting&page=2&category=1&divpage=11,http://www.ppomppu.co.kr/zboard/view.php?id=consulting&page=1&divpage=11&category=1&no=74200,컨설턴트를 선택하여서 쪽지나 유선연락을 주시면 빠른 상담 받아보실 수 있습니다. 맹창호 컨설턴트 010 8286 5800,임신을 축하드립니다. 태아보험은 어린이보험에 태아특약을 구성하여 종합보험형태로 가입을 하고 여기에 의료실비보험을 같이 가입하게 됩니다. 단독실비+종합보험의 형태입니다. 의료실비는 1년마다 갱신되면서 15년마다 재가입을 하는 공통적인 표준약관을 적용하며 최대 보장기간은 100세까지이며 전보험사가 보장이 동일하고 보험료 차이만 있습니다. 종합보험은 보통 30세만기로 많이 하는 편이며 성장기간에 집중적으로 보장을 받으면서 보험료는 저렴하게 가입할 수 있는 방법입니다. 22주전에 가입을 해야 태아관련특약을 가입하실 수 있으며 출생예정일이 나오면 가급적 미리 가입하는 것을 추천드립니다. 구체적인 설계안과 보험료의 확인은 컨설턴트명 클릭 후 양식에 맞게 쪽지 보내 주시거나 핸드폰으로 연락 주셔서 구체적인 상담 및 설계 받아보시기 바랍니다. 정재환 컨설턴트 010 4202 8239 ,태아보험이란 어린이보험+태아특약 선천성이상수술비 저체중아육아비용 출생위험 이 포함된 것을 말하는데요. 태아특약은 22주6일 이내에 가입이 가능하며 임신을 확인하고 최대한 빠른시간에 가입을 하시는것이 좋습니다. 의사선생님의 권유로 유산방지제 처방을 받거나 산모님의 건강상태에 이상이 생길경우 가입이 지연되거나 거절이 될수 있기 때문입니다. 20년납 기준으로 주요 진단비와 어린이 보장 특약들을 30세로 하면 4 5만원대로 주요 진단비를 80세로 하면 8 9만원대로 준비하실수 있습니다. 주요진단비 암 뇌혈관 심혈관 질병후유진단비 어린이보장특약 입원일당 수술비 골절 화상진단비등 1년뒤 태아특약이 소멸되고 위험률 감소로 실비 보험료가 낮아지면 3년뒤엔 가입시보다 총보험료에서 2 3만원 적은 금액으로 유지가 가능하며 선천적질환을 유일하게 보장하고 보상청구 피드백이 좋은 현대해상이 경쟁력이 있습니다. 컨설턴트 선택후 개별문의 주시면 보다 자세한 안내 받아 보실수 있습니다. 건강하고 행복한 태교하시기 바랍니다 ,진심으로 축하드립니다 태아보험은 임신중에 가입하여 출생시 일어날수 있는 위험에 대한 보장을 준비하는 보험으로 실손의료비와 인큐베이터비용이나 선천성이상관련수술비등과 함께 영유아기때 보장을 위한 입원일당 각종수술비 진단비 후유장해등을 주된보장등이 있구요 가장 일반적인 방법은 실손의료비는 단독으로 준비를 해야 하고 평생보장으로 갖고 가시는 거구요 태아관련보장들은 영유아기때 보장에 집중하시고 특약들은시간경과에 따른 보장금액의 실질화폐가치를 고려해서 30세만기로 하시는 방법이 가장 경쟁력이 있는데 이렇게 하시면 현대해상으로 총 5만원대로 충분한 구성이 가능하세요 태아보험 관련해서 전반적인 안내는 아래 정보글을 확인해보시구요 실질적인 도움이 되었으면 좋겠네요 http www.ppomppu.co.kr zboard view.php id consulting&no 71763&slave off 컨설턴트 이름을 클릭시면 추천설계안과 더불어 정확한 안내를 받아보실수 있습니다 강치환 컨설턴트 010 8640 3646,임신을 축하드립니다. 태아보험 준비하실 때는 치료비가 많이 들어가서 경제적인 부담을 덜기 위함이기 때문에 중대질병인 암진단이나 뇌 심장질환 담보나 자주 청구되는 입원일당 등은 최대로 구성하시는게 유리합니다. 22주 6일전에 가입을 하시면 저체중아입원일당이나 선천이상수술담보 등을 추가해서 가입이 가능하지만 가능하면 태아와 산모님 모두 건강하실 때 기형아 검사전에 안전하게 미리 준비해 주시는게 유리하세요. 3대진단비 만기 설정을 어떻게 하는지에 따라 추천 플랜이 달라집니다. 만기를 길게 가입을 원하신다면 미해지환급형과 조합 구성으로 추천을 드립니다. 1 2년 납입하시는게 아니기 때문에 영유아기 중심으로 보장 받을 수 있도록 납입에 부담없는 선에서 설정해서 가입을 하시는게 좋습니다. 추천설계안을 직접 요청하셔서 설계안을 받아보시고 설계안에 대한 설명을 꼭 들어보신 후에 영유아기 중심으로 보장 받을 수 있게 준비하시기 바랍니다. 전은화 컨설턴트 010 6277 1844 
