,Section,No,Question,List URL,Contents URL,Answer1,Answer2,Answer3,Answer4,Answer5
17,Insurance,74185,"35살 남자 보험 가입 상담입니다  자영업 아이 둘 있습니다. 단독실비는 가입되어 있고, 흔히 추천해 주시는 암 심장 뇌질환을 가입하려고 하는데 상품을 추천해 주시면 감사하겠습니다.",http://www.ppomppu.co.kr/zboard/zboard.php?id=consulting&page=2&category=1&divpage=11,http://www.ppomppu.co.kr/zboard/view.php?id=consulting&page=1&divpage=11&category=1&no=74185,실비는 준비가 되어 있으시니 생각하시는것처럼 주요질환정도 납입여력선에 맞춰 준비해주시기 바랍니다. 암보장의 경우 대장점막내암 및 생식기 전립선 방광암을 일반암으로 보장하며 소액 우사 암도 일반암의 20%이상 보장하고 뇌 심장의 경우 뇌졸증과 급성심근경색.뇌혈관 허혈성심장질환까지 폭넓은 보장이 가능한 보험사로 선택해주시는것이 좋으며 MG손해보험과 농협손해보험이 가장 경쟁력이 있구요. 보장 만기는 80세나 90세가 효율적이며 추천드리는 상품들의 경우 미해지환급형 상품으로 일반 상품에 비해 2 30% 저렴한 보험료로 준비하실수 있는 이점이 있습니다. 맞춤 설계를 드리기 위해서는 생년월일 직업 병력사항 가족력등에 대한 확인이 필요하구요. 장기간 납입하시고 보장 받으셔야 하는만큼 부담되지 않는선에서 준비하시는것이 가장 중요합니다. 컨설턴트를 통해 납입여력 및 보장니즈에 맞는 추천안과 자세한 상담 받아보신후 든든한 보험으로 준비해주세요. 최광옥컨설턴트 010 9953 1379,안녕하세요 아이둘을 둔 가장이시면은 3대질환 진단비를 안전하게 준비하시는게 좋습니다. 3대질환진단비 가입시 확인할 사항은 전립선암 방광암 대장점막내암 대장암 초기단계 을 일반암에 포함되야 하며 소액암 갑상선암 제자리암 기타피부암 경계성종양 일반암의 20%이상 확인하시구요. 뇌출혈보다는 보장범위가 넓은 뇌혈관진단비 뇌졸중 뇌경색 뇌출혈등 포함 가 좋구요 급성심근경색보다는 보장범위가 넓은 허혈성심장질환비 협심증 만성심장질환 급성심근경색등 포함 로 준비하시구요. 보험료가 오르지 않는 비갱신형으로 하고 환급금미지급형이 순수보장형 대비 20 30% 저렴해 경제적입니다. 손보사로 농협과 엠지가 경쟁력있습니다. 만기 진단비 구성에 따라 보험료는 달라질 수 있어 생년월일 직업 병력사항 부담되지 않는 보험료선을 알면 정확한 설계안을 보내드릴 수 있습니다. 빠른 상담을 원하시면 아래 핸드폰번호로 상담요청 문자나 연락주시거나 컨설턴트 이름을 클릭해서 쪽지로 연락처를 남겨 주시기 바랍니다. ,35세 자영업이시라면 MG손해보험이 의무사망에 대한 보험료를 적게 부담할 수 있고 암 뇌혈관 허혈성질환에 대한 진단금을 충분히 구성이 가능하십니다. 가장 우선적으로 진단금을 충분히 구성을 하시고 보험료에 대한 여유가 있으시다면 수술비와 후유장해 특약을 적절하게 추가해 주시면 좋습니다. 컨설턴트를 선택하여서 쪽지나 유선연락을 주시면 빠른 상담 받아보실 수 있습니다. 맹창호 컨설턴트 &nbsp010 8286 5800,이미 기존 단독실손만 가입되어 있으시다면 병원비용이 많이 들어 가는 주요 진단비위주로 보장을 준비하시면 됩니다. 암진단비 뇌혈관질환 허혈성 심장질환 등의 비갱신 진단비로 보 장을 준비하시면 되는데요 암진단비는 전립선 대장점막내암을 포함하여 보장하는 보험사 뇌 질환 허혈성 심장질환 등의 보장범위가 넓은 보험사를 선택하시는 것이 좋습니다. 진단비 가입금액 만기설정을 어느정도로 설정하느냐에 따라 설계 금액은 각기 다릅니다. 30대 남성 회원님의 경우 농협손보 엠지손보가 비교대상입니다. 회원님의 생년월일 직업 5년내 병력사항 실손청구 이력 등의 기본 사항에 맞는 보장으로 비교 안내 받아보시기 바랍니다. 컨설턴트 선택후 쪽지나 유선으로 문의 하시면 회원님의 니즈와 상 황에 맞는 보장으로 안내 받아보실수 있습니다. 이수미 컨설턴트 010 8743 7139 ,35세시면 농협이나 엠지를 추천 드리는데요 우선적으로 농협을 추천 드립니다. 단독실비만 있으시면 거의 대부분을 구성을 해야 하므로 엠지보단 농협이 적합합니다. 농협손보로 해지환급금미지급형 상품으로 설계를 하면 보험료도 저렴하면서 보장내용도 좋습니다. 정확한 설계를 하려면 가입하시는 분의 기본적인 정보가 있어야 가능합니다. 생년월일 직업 원하시는 보험료 및 병력 사항 등 확인해 주시고 상담신청 해주시기 바랍니다. 컨설턴트명 클릭 후 양식에 맞게 쪽지 보내 주시거나 핸드폰으로 연락 주셔서 구체적인 상담 및 설계 받아보시기 바랍니다. 정재환 컨설턴트 010 4202 8239 
18,Insurance,74184,보험 리모델링 포트폴리오 좀 보내주세요  쪽지 주시면 메일 보내드리겠습니당 검토 후 해지하고 바로 가입하겠습니다! 나이 26세 현재 ci보험에 실비특약 <9만원>     치아보험 <3만원> 보장성 가성비 보험 추천드리겠습니다,http://www.ppomppu.co.kr/zboard/zboard.php?id=consulting&page=2&category=1&divpage=11,http://www.ppomppu.co.kr/zboard/view.php?id=consulting&page=1&divpage=11&category=1&no=74184,익명게시판이라 인증컨설턴트가 먼저 쪽지를 보내드릴 수도 없습니다. 가입하신 보험의 보장내용을 분석한 후 삭제하거나 부족한 부분을 보완하는 합리적인 선택이 좋습니다. 빠른 상담을 원하시면 아래 핸드폰번호로 상담요청 문자나 연락주시거나 컨설턴트 이름을 클릭해서 쪽지로 연락처를 남겨 주시기 바랍니다. ,보장내용을 확인하지 않아도 회원님의 나이에 비해서 많은 보험료를 지출하고 계십니다. 특히 치아보험의 경우 가입 후 1년이내 보장을 받으실 것이 아니라면 꼭 필요한 보험은 아닙니다. CI 보험의 경우 2013년 4월 이전에 가입을 하셨다면 리모델링 그 이후에 가입을 하신 상품이라면 해지를 하시고 새롭게 실비+3대질환 진단금과 성인질환 수술비 구성을 재가입을 하시는 것이 보장이나 보험료면에서 유리하십니다. 컨설턴트를 선택하여서 쪽지나 유선연락을 주시면 빠른 상담 받아보실 수 있습니다. 맹창호 컨설턴트 &nbsp010 8286 5800,가입중이신 보험을 우선 보장분석을 받아 보시는 것이 순서입니다. 증권을 구비하셔서 게시판에 올려주시거나 개별상담신청으로 보내주시기 바라구요 정확한 설계를 하려면 가입하시는 분의 기본적인 정보가 있어야 가능합니다. 생년월일 직업 원하시는 보험료 및 병력 사항 등 확인해 주시고 상담신청 해주시기 바랍니다. 컨설턴트명 클릭 후 양식에 맞게 쪽지 보내 주시거나 핸드폰으로 연락 주셔서 구체적인 상담 및 설계 받아보시기 바랍니다. 정재환 컨설턴트 010 4202 8239 ,우선 유지중이신 보험에 대한 확인부터 했으면 좋겠구요 보험은 유지에 부담이 없는 보험료를 기준으로 해서 보장의 우선순위에 맞게 회원님을 위한 보장에 집중하시면 되세요 그럴때 기준은 암 뇌 심장질환에 대한 보장이시고 손해보험사로 비갱신형으로 하셔야 합니다 CI보험에 실손의료비가 포함되어 있으시다면 회원님은 진단비에 촛점을 맞춰서 설계하시면 되시구요 CI보험이 주계약의 정도에 따라서 유지를 전제로 뇌질환과 심장질환만 집중하시면 되시는지 아니시면 암까지도 함께 구성을 해야 하는지를 판단하시면 되세요 컨설턴트에게 상담문의를 하셔서 회원님이 원하시는 보장에 대한 효율적인 추천설계안과 정확한 안내를 받아보시길 바랍니다 강치환 컨설턴트 010 8640 3646,#NULL
19,Insurance,74183,"30대 중반 기혼남성 보험설계 부탁드립니다.  설계사님들 감사합니다. 설계사님 도움으로 운전자보험까지는 잘 가입완료했습니다!!! 이어서 상담드립니다!!!     [제 정보]    기혼 / 자녀 無 / 34세 / 병력 無(수술 無) / 아버지는 고혈압, 당뇨, 통풍 있으십니다...    술, 담배 X / 직장 사무직(60세까지 정년 보장됨)   월 보험료 20만원 수준 설계 희망(월 납입 가능 금액은 고민 중입니다. 적정선이 있을까요?)   ※ 와이프 32세 공무원      [현재 보험]    1. 운전자보험(한화 차도리로 월 5천원대 납입 中)    2. 우체국 하이로정기보험(정기만기) / 보장만기일 2066년(80세) / 월 보험료 47,000원(납입만기는 2026년) ※세부 보장내역 아래 참조 ▶▶ 추가! 우체국 고객센터 상담결과 현재까지 납입액 703만원현재 기준으로 해약시 해약금액 550만원 환급, 배당금 25만원 환급으로 582만원(83%) 환급 예정   3. 직장 단체보험 ※세부 보장내역 아래 참조            [고민(=질문 내용)]    Q1. 실손보험 반드시 가입해야하는지요? 한다면 어느 보험사, 어떤 수준. 어느 정도가 좋은지요?    Q2. 실손 외 암/뇌/심장 관련 보험도 가입해야하는지요? 한다면 어느 보험사, 어떤 수준. 어느 정도가 좋은지요? (혹은 Q1 Q2 보험 외 다른 필수적으로 가입해야할 보험이 있는지요?)   Q3. 기존 우체국 보험(세부내역 하단 참조) 유지가 나을까요, 해지가 나을지요?   Q4. 회사 단체보험의 보장 범위가 좋아보이는데(배우자도 보장해주고~ 심지어 출산까지도 보장해줄 정도라면!) 굳이 실손보험 및 암/뇌/심장 관련 보험을 들어야할 필요가 있을지요? (참고로 회사는 정년 보장이 확실합니다. 어차피 입원의료실비는 단체보험에서도 보장하고 개인 실손보상이 있어서 중복보상 되지 않으므로 제가 굳이 개인 실손을 들어야할까요?)   Q5. 와이프도 실손 및 암/뇌/심장 관련 보험 없는데       지금 제가 상담하는 것처럼 제꺼 진행하고 와이프꺼 순차적으로 해도 되는지요?       아니면 같이 한 번에 상담받아서 한 번에 두 명 다 가입해야 혜택이 더 큰지요?     [참고1 - 본인(=남편) 우체국 보험 보장범위]   [참고2 - 본인(=남편) 직장 단체보험 보장내역]   ",http://www.ppomppu.co.kr/zboard/zboard.php?id=consulting&page=2&category=1&divpage=11,http://www.ppomppu.co.kr/zboard/view.php?id=consulting&page=1&divpage=11&category=1&no=74183,설계사님들 감사합니다. 설계사님 도움으로 운전자보험까지는 잘 가입완료했습니다 이어서 상담드립니다 , , , 제 정보 ,기혼 자녀 34세 병력 수술 아버지는 고혈압 당뇨 통풍 있으십니다
20,Insurance,74182,ci보험 해지 문의합니다.    안녕하세요.     29세남자입니다. 현재 보험은 약 13년정도 납부한 상태입니다.   부모님께서 넣어주셨는데 하나는 삼성ci보험 50년납부 다른 하나는 한화생명 ci보험 20년납부입니다.    삼성은 월5만원 한화생명은 월11만원정도 납부중입니다~   ci보험이 보험금 타기가 힘들다고 하던데 굳이 2개가 다 필요한지 궁금하고 특히 50년납부가 너무 부담스러운 상태라 손절을 해야하나 리모델링을 해야하나 궁금해서 문의글 올립니다.   현재 ci보험2개 실비보험 암보험 1개씩 가지고 있는 상태입니다.                     1. 삼성생명 ci보험                      2. 한화생명 ci보험           ,http://www.ppomppu.co.kr/zboard/zboard.php?id=consulting&page=2&category=1&divpage=11,http://www.ppomppu.co.kr/zboard/view.php?id=consulting&page=1&divpage=11&category=1&no=74182,둘다 해지하시기 바랍니다. 20대의 젊은분에게는 전혀 어울리지도 않고 맞지도 않은 보험을 가입 중입니다. CI보험을 유지하는 경우는 정말 오래되었고 납입기간이 얼마 안남았으며 실비특약이 들어가 있어서 해지하기 아까운 그런 경우가 아니면 왠만하면 정리하시는 것이 좋습니다. CI보험에 대한 잘못된 가입으로 인해 정말 수많은 분들이 불이익을 당하고 있습니다. 더 늦기전에 해지하시고 실비와 3대진단비 종합보험으로 갈아타시기 바랍니다. 컨설턴트명 클릭 후 양식에 맞게 쪽지 보내 주시거나 핸드폰으로 연락 주셔서 구체적인 상담 및 설계 받아보시기 바랍니다. 정재환 컨설턴트 010 4202 8239 , 삼성생명 CI 2005년가입 50 500 중대한 수술이나 중대한 질병으로 진단을 받을 경우 최초 1회에 한하여 사망보험금의 일부를 선지급하고 남는 보험금이 사망보장으로 남습니다. CI보험에 대해 정리한 다음의 정보글을 확인바랍니다. http www.ppomppu.co.kr zboard view.php id consulting&no 71755 10년넘게 납입하셨으나 앞으로 납입해야할 기간이 훨씬 길고 메리트 있는 특약이 없습니다. 해지하시기 바랍니다. 한화생명 CI 월보험료 11만원 삼성생명과 동일한 구조로 CI발생시 최초1회에 한하여 사망보장의 80%를 선지급합니다. 주요 특약으로 뇌출혈 급성심근경색 각각 2천씩 가입되어 있으나 사망보장을 기본으로 하기때문에 보험료가 높고 상대적으로 건강보장은 빈약합니다. 5년이내 특별한 병원치료력이 없다면 두보험 다 해지하시고 지금이라도 실비와 3대진단비를 핵심으로 손해보험사 통해 준비하시기 바랍니다. 실비는 전 보험사가 공통약관을 사용하여 보장내용이 동일하므로 보상청구 피드백이 좋은 중대형 손보사통해 월 1만원대로 준비하실수 있으며 진단비는 30세 이하 회원님의 경우 어린이보험 환급금미지급형 상품을 통해 방광암 전립선 대장점막내암은 일반암으로 보장하면서 유사암 최대 2천까지 보장받으실수 있고 뇌출혈 뇌졸중 급성심근경색보다 보장범위 넓은 뇌혈관 허혈성진단비로 각각 2천씩 가입이 가능합니다. 20년납 비갱신 순수보장형으로 만기를 90세로 설정하셔도 보험료 7 8만원 안팍으로 준비가 가능합니다. 해지로 인한 당장의 금전적인 손해는 보시겠으나 장기적인 측면에서 보면 기회비용을 아껴 더 좋은 보장으로 준비하는 기회가 될수 있습니다. 컨설턴트 상담을 통해 니즈와 납입여력에 기준한 추천설계안으로 비교안내 받아 보시기 바랍니다. ,삼성 CI보험은 납입기간이 문제이시구요 한화변액 CI보험은 사망이외에는 메리트가 없습니다 사망에 대한 보장이 필요하시다면 CI보험이 아닌 일반 종신이나 정기보험으로 하셔야 하시구요 지금은 회원님을 위한 보장에 집중하셔야 하는데요 이 보험들은 실손의료비와 진단비입니다 올려놓으신 보험이외에 유지중이신 실비보험과 암보험을 함께 봐야 할테구요 보험은 유지에 촛점을 맞춰서 보장을 설계하셔야 하시구요 보장의 우선순위가 있기 때문에 회원님을 위한 보장이 제대로 된 다음에 필요에 따라서 사망에 대한 보장을 준비하시면 되세요 유지중이신 보험을 확인한후에 부족한 보장을 보완하시는 형태로 하시구요 지금 올려놓으신 보험은 여기까지만 납입하시는 걸로 하시면 좋겠습니다 컨설턴트에게 상담문의를 하셔서 보다 자세한 안내를 받아보시길 바랍니다 강치환 컨설턴트 010 8640 3646,1. 삼성생명 보통 보험은 경제활동시기에 완납을 하고 노후에 보장을 받을수 있도록 납입기간을 설정합니다. 50년납입이면 앞으로 훨씬 더 많은 보험료를 납입하셔야 합니다. 감액 완납이나 해지를 고려해 보시기 바랍니다. 장기간 유지할만큼 경쟁력이 있는 보험이 아니기 때문입니다. 2. 대한변액보험 이보험은 더더욱 유지할 메리트가 없습니다. 납입하시는 보험료에 비해 받을수 있는 보장이 너무 부실합니다. 정리하시기 바랍니다. 리모델링 보험사에 고지하실 병력만 없으시면 해지하시고 다시 가입하시는게 좋겠습니다. 이보험들을 유지하셔도 이보험들로 커버되지 않는 실비보험이나 소액암보장 뇌혈관 심혈관질환 진단금은 또 가입하셔야 하기 때문입니다. 지금 해지하시면 손해는 발생하지만 앞으로 납입하실 보험료 받으실 보장 기회비용을 고려하신다면 지금 정리하시는게 꼭 손해만은 아니실 겁니다. 현재 가입이 가능한 플랜과 비교해 보신 후 선택하시기 바랍니다. 컨설턴트를 선택해 쪽지 문자로 문의해 주시면 자세한 안내를 받아보실수 있습니다. 정재성 컨설턴트 010 9131 1865,#NULL
21,Insurance,74181,변액보험 해지문의  약 1년전쯤 친구에게 오렌지라이프변액보험하나 들었습니다 그 당시에는 친구에게 사업비얘기는 전혀 듣지못하였구요 그냥 저축한다 생각하고 가입하래서 사인하였습니다 보험증권 이런것도 전혀 받지 않았구요 녹음이나 증거? 이런건 하나도 가지고있지 않습니다 이거 손실없이 해지하고싶은데 가능할낀요? * insurance 에서 게시물 이동되었습니다 (2018-11-12 18:20 / no : 72038),http://www.ppomppu.co.kr/zboard/zboard.php?id=consulting&page=2&category=1&divpage=11,http://www.ppomppu.co.kr/zboard/view.php?id=consulting&page=1&divpage=11&category=1&no=74181,#NULL,#NULL,#NULL,#NULL,#NULL
22,Insurance,74180,갑상선 진단금 높은 보험 추천요청  다른 암보험은 준비가 되었는데 갑상선이 가족력도 있고 요즘 많이 걸리더라구요 얼마전 삼성화재에서 진단금 2천만원짜리가 있던데 괜찮은가요? 삼성화재 건강보험 태평삼대였는데.. 다른 보험사도 추천보험있으시면 알려주세요~ * insurance 에서 게시물 이동되었습니다 (2018-11-12 18:18 / no : 72039),http://www.ppomppu.co.kr/zboard/zboard.php?id=consulting&page=2&category=1&divpage=11,http://www.ppomppu.co.kr/zboard/view.php?id=consulting&page=1&divpage=11&category=1&no=74180,해당상품의 경우 소액암진단비 2천만원의 구성을 위해서는 일반암진단비도 2천만원을 구성해야 합니다. 상성화재의 경우 암보장의 범위가 좁은데다가 무엇보다 해당상품은 갱신형 상품입니다. 갱신형 상품은 만기까지 계속하여 보험료를 납입해야 하고 위험율이 낮은 연령대에는 보험료가 저렴하지만 위험율이 올라가는 연령대에는 보험료가 가파르게 올라 유지가 어려우 추천하여 드리기 어렵습니다. 우선은 보유하신 보험의 보장내용에 대한 확인을 받아 보시고 부족하거나 과하지 않은 보완하여 주시는 것이 좋겠습니다. 컨설턴트명 선택하셔서 문의하시거나 하기의 연락처로 연락주시면 자세한 상담 받아 보실 수 있습니다. 박진우 컨설턴트 010 2010 2055,안녕하세요 삼성화재 태평삼대는 갱신형이라 권해드리기 어렵습니다 보험은 유지가 가능한데 갱신형은 보험료가 크게 올라 유지가 어려워질 수 있으니까요 보통 갑상선암 등 유사암 소액암 에 대한 보장은 암진단비에 포함되어 보장되거나 별도의 소액암진단비가 추가되는 식으로 설계됩니다. 별도로 설계되는 경우에도 소액암진단비만 넣을 순 없구요 소액암에 대한 보장의 크기는 보통 일반암진단비의 10%나 20%까지 가능하지만 회사에 따라 일반암진단비의 50%까지 최대 1천 2천 가능한 곳도 있지요 보험연령으로 30세를 초과하셨다면 최대 1천만원까지이며 30세미만이시면 MG손보를 통해 2천만원까지는 가능하시구요 더 궁금한 점 있으시면 아래의 컨설턴트 명 클릭 후 말씀 남겨주시기 바랍니다. 좋은 하루 되세요 최상길 컨설턴트 010 7379 1774,보장대비 보험료는 삼성보다는 타사가 좋기 때문에 다시 알아보세요 암보험을 가입하실때는 회사별로 보험료만 비교를 하시는게 아니라 일반암과 소액암의 보장 범위를 꼭 확인을 해보셔야 하세요 생식기암 유방 자궁 난소 전립선 에 대해서 일반암으로 보장을 해주고 소액암을 20%이상 보장을 해주는 회사로 준비를 하시면 되겠습니다 컨설턴트 이름을 클릭 하시면 상담 요청을 남기실 수 있습니다 고객님 니즈에 맞는 설계서와 회사별 비교 안내를 도와드리겠습니다 한지영 컨설턴트 010 8888 3948,갑상선암은 대부분의 보험사가 유사암으로 보장이 되기에 일반암 진단비 가입금액의 10 20% 내외로 보장을 합니다. 삼성화재의 암보험은 갱신형으로 가입이 되므로 장기 유지 및 납 입에 유리한 상품은 아닙니다. 회원님의 연령에 따라 추천 보험사는 달라질수 있으며 기존 가입 된 보장을 먼저 점검 받아보신후 부족한 진단비로 보강하시는것을 권장해드립니다. 컨설턴트 선택후 쪽지나 유선으로 문의 하셔서 빠른 비교 안내 받 아보시기 바랍니다. 이수미 컨설턴트 010 8743 7139 ,삼성화재상품은 추천드릴 만한 보험이 자동차보험 말고는 없습니다. 암보험은 갱신형이 아닌 비갱신형으로 가입을 하셔야 합니다. 가입자분의 연령대를 알려주시면 적합한 상품을 추천 드릴 수 있습니다. 갑상선암은 일반암에 딸려 있는 유사암으로 보장되거나 특약으로 유사암에 포함되는 것으로 갑상선암만 따로 보장을 받는 보험은 없습니다. 일반암보험으로 가입하시면서 같이 구성을 해야 합니다. 컨설턴트명 클릭 후 양식에 맞게 쪽지 보내 주시거나 핸드폰으로 연락 주셔서 구체적인 상담 및 설계 받아보시기 바랍니다. 정재환 컨설턴트 010 4202 8239 
23,Insurance,74179,후유장해 질문  질병이나 상해 후유장해를 80미만으로 넣으려고 했는데 왜 다들 넣지 말라 하는걸까요? 제가 생각하기에는 디스크 위험도 있고 관절수술도 하게될거같아서 오히려 3대질환보다 보험금을 받을 확률이 높을것 같아서요 혹시 이유를 알 수 있을까요? 보험금 타기가 그렇게 많이 까다로운가요?  * insurance 에서 게시물 이동되었습니다 (2018-11-12 18:16 / no : 72041),http://www.ppomppu.co.kr/zboard/zboard.php?id=consulting&page=2&category=1&divpage=11,http://www.ppomppu.co.kr/zboard/view.php?id=consulting&page=1&divpage=11&category=1&no=74179,다들 넣지 말라고 하지 않습니다. 필요하시면 넣으시면 되구요 특히 질병후유장해는 도움이 됩니다. 상해후유장해도 최소 5천이상 1억정도는 합산해서 가입해 두시면 좋습니다. 후유장해가 보장받기 까다롭다고 넣지 말라고 하는데 보험이란것은 빈틈없이 만약의 사고에 대해서 폭넓게 보장 받도록 가입하는 것이 중요하며 그 중에서도 후유장해는 보장의 기본 중의 기본입니다. 질병후유장해는 예전에는 몰라서 가입을 못했으며 없어서 가입못했던 특약입니다. 실비와 3대 진단비 보장이 충분히 잘 구성이 된 상태에서 마지막으로 가입을 해야되는 보장이 질병후유장해입니다. 따라서 1 2천만원은 별 의미없고 가입하려면 될수록 많이 가입 하는게 유리합니다. 컨설턴트명 클릭 후 양식에 맞게 쪽지 보내 주시거나 핸드폰으로 연락 주셔서 구체적인 상담 및 설계 받아보시기 바랍니다. 정재환 컨설턴트 010 4202 8239 ,후유장해는 추천하는 특약입니다 특히 상해후유장해의 경우에는 상해관련된 특약들중에 가장 크게 보장을 하게 되는데요 이 부분을 제대로 준비하시면 불의의 사고로 인해 신체의 영구적인 손상에 대해서 경제적으로 도움이 되실수 있습니다 명확한 장해는 보장을 받는데 문제가 없습니다 질병후유장해는 상해후유장해에 비해 선택인데요 암 뇌 심장질환에 대한 보장에 대한 준비가 되어 있는 상태라면 질병후유장해는 추가적으로 함께 구성하시는 것도 좋습니다 컨설턴트에게 문의하셔서 보다 명확한 안내를 받으시길 바랍니다 강치환 컨설턴트 010 8640 3646,#NULL,#NULL,#NULL
